name,order,speech_no,page_no,time_stamp,name_id,state,party,in_gov,first_speech,body,question,answer,q_in_writing,div_flag,gender,unique_id,interject,senate_flag
business start,1,1.0,,,,,,0,0,,0,0,0,0,,,0,1
Senator HIGGS,2,2.0,8.0,,KHE,Queensland,,0,0,"Do not honorable members think that this is very sudden ? We are all, I should imagine, anxious to do business, and other Senators will come here in a very few minutes expecting to do business.",0,0,0,0,,,0,1
Senator O'CONNOR,3,3.0,8.0,,JYD,NEW SOUTH WALES,Protectionist,1,0,"There must be an adjournment for lunch ; we propose that that adjournment shall take place now, and at half-past two o'clock the Senate will assemble in the ordinary way for the transaction of business. It was never intended, no matter how many senators might be here, to proceed to business before the luncheon hour. Question resolved in the affirmative.",0,0,0,0,,,0,1
stage direction,4,,,13:15:00,,,,0,0,Senate adjourned at 1.15 p.m.,0,0,0,0,,,0,1
Senator O'CONNOR,5,4.0,9.0,,JYD,New South Wales,Protectionist,1,0,"I would remind the Senate that the time has arrived for electing a President, and, as I understand that there is not likely to be a unanimous choice in the first instance, I think it would be well if we were to lay down at once a method of procedure by which in the end the will of the majority might prevail. As honorable members are aware, the House of Commons' practice would guide a body of this kind in the absence of express direction by ourselves. I think it will be evident that, in the event of there being more than two candidates, the putting of several motions successively would very likely result in the election of a President who would not' be the choice of the majority of the House. The experience, I think, of all of us who have had much to do with deliberative bodies is that, in these circumstances, there is only one way of ascertaining the choice of the majority, and that is by the system of what is called exhaustive ballot. I propose therefore that, inasmuch as under the circumstances which are likely to arise, it is necessary to have some other procedure than that of the House of Commons, the Senate should lay down for itself a form of procedure to be adopted during this election of President. I put my proposal in the form . of a motion, which I ask the consent of the Senate to submit without notice. It is as follows : - That if no more than two candidates are proposed, the House of Commons,' practice be adopted ; that if more than two candidates are proposed, the Senate proceed to ballot ; that all candidates except the two highest on the first ballot drop out ; that if on the first ballot any candidate has an absolute majority of the votes given, he shall be declared elected President ; but if no candidate has such absolute majority, a second ballot be then taken, and that the candidate then obtaining the highest number of votes be declared elected President. That, I think, will commend itself to honorable members as a method by which we can, in a most certain way, elect a President who shall be the choice of the majority of the members of the Senate. I would like also to make a suggestion. I do not intend to put it in any formal way. Considering the nature of the office and the duties of President, and considering also the qualifications, the well-known character, and ability of the gentlemen who are likely to be nominated, it would be very much better for honorable members to content themselves by simply moving and seconding the candidates that they propose. I need not enlarge on the reasons which I think will commend that course to the Senate. I make that suggestion in the hope that honorable members will see that it will be conducive, perhaps, to good results, if that procedure be followed. I propose the motion I have read in order that the Senate may have the procedure settled for the purpose of this first election of a President.",0,0,0,0,,,0,1
Senator Sir JOSIAH SYMON,6,5.0,9.0,,K7V,South Australia,,0,0,"I should like to ask Senator O'Connor whether it might not be well to adopt the House of Commons' practice after the first ballot has eliminated the third candidate. If in the first instance there be only two candidates, it is proposed that the House of Commons' practice be adopted ; and there seems to be no reason why, when we have eliminated the third candidate, the voting on the two who remain should not be open, according to the House of Commons' practice. I would suggest that an august body, such as we hope the Senate will always be, should not shrink from open voting upon the determination of the highest office in the gift of this Chamber. I think that we should be doing honour to ourselves by adopting that course, because I am sure that, whatever our views may be as to the respective candidates, we shall give the most loyal obedience to whoever may be chosen, and aid him in maintaining the dignity and prestige of this Chamber. Senator O'CONNOR
                    (New South Wales Vice President of the Executive Council). - In answer to the honorable member, I think it will be universally admitted-",0,0,0,0,,,0,1
Senator Sir John Downer,7,5.0,9.0,,JVG,,,0,0,"If this is a reply, I would like to say something.",0,0,0,0,,,1,1
Senator O'CONNOR,8,5.0,9.0,,JYD,,,0,0,"If there is to be a debate I shall defer what I have to say. I was answering a' question, and I thought that by doing so I should save debate.",0,0,0,0,,,1,1
Senator Sir John Downer,9,5.0,9.0,,JVG,,,0,0,It will save debate.,0,0,0,0,,,1,1
Senator O'CONNOR,10,5.0,10.0,,JYD,,,0,0,"I think the Senate will admit at once that it is not from any desire that any Senator has to conceal his opinions as to the candidate who ought to occupy the chair that we propose to adopt the system of ballot. It is done to get rid of the difficulty which very often arises owing to the cross voting which occurs where you have three motions submitted, and in consequence of which you may have a person chosen as President who is not the choice of the majority. It appeal's to me that, once having adopted the method of ballot, it should be carried right through. Therefore, although I quite assent to a good deal of what the honorable member has said, I think it will be a simpler and more satisfactory process if, when once the ballot begins, it is carried right through in the ordinary way in which these ballots proceed.",0,0,0,0,,,1,1
Senator MILLEN,11,6.0,10.0,,KUL,New South Wales,,0,0,"X
                        take it that the point raised by
                        Senator Sir Josiah
                        Symon is that there is an inconsistency in the motion as it is presented, in that whilst it is proposed if there are only two nominations, that we adopt open voting, in the event of there being more than two we are, having eliminated the surplus number, to have a ballot. To put the matter in another way, if we are to have open voting for one set why not for the other, or if, having reduced the number to two, we are to have a secret ballot, why should we depart from that principle if there are only two nominations ? I am not prepared to say that there is very much merit in one system over the other. But I think that, whatever system we adopt, there should be uniformity, and I would suggest to
                        Senator O'Connor
                        that he might amend his motion so as to make the procedure in the one set of circumstances uniform with the procedure in another set of circumstances.",0,0,0,0,,,0,1
Senator O'Connor,12,6.0,10.0,,JYD,,,0,0,It is well known that the probabilities are that there will be three candidates.,0,0,0,0,,,1,1
Senator Sir JOHN DOWNER,13,7.0,10.0,,JVG,South Australia,,0,0,"Yes ; but I am inclined to agree with the last speaker. We know, so fur as human beings can know in the circumstances in -which we are placed, that there will be at least three candidates. Under the circumstances, the first proposition in this motion will certainly not arise. The procedure should be uniform throughout, and I think, therefore, that the first part of the motion might be omitted, and that we. might say generally that the voting shall be by ballot, and that, if there are more than two candidates, it shall be in the manner Senator O'Connor has proposed. It is not a matter of very much consequence, to tell you the truth, nor is it worthy of a very great amount of discussion, but if it will prevent conflict and save time, I would suggest that the first part of the motion be struck out, and that the one method of voting be adopted.",0,0,0,0,,,0,1
Senator HIGGS,14,8.0,10.0,,KHE,Queensland,,0,0,"I appreciate the desire of honorable members to get to business, because Upper Houses are not deemed to be bodies which are anxious to do business in a rapid way. I dare say it will come as a surprise to those who have occupied positions in other Parliaments that such a feeling exists. Knowing nothing of the capacity of either of the gentlemen who are about to be -proposed - not even knowing their names, because I am not in the confidence of those who are prepared to submit nominations - I think that the mover and seconder should in each case give us some reasons why we should vote for their particular candidate. We are about to appoint a gentleman to a very high office, and I agree that he should be one who can fill it with dignity and impartiality. My great desire is to cast my vote for an honorable member who will endeavour to give us just decisions whenever the standing orders of the Senate have to be interpreted, so that I do not at all fall in with the proposal of Senator O'Connor that the candidates should simply be nominated, that nothing should be said either for or against them, but that we should proceed forthwith to vote. Senator NEILD
                    (New South Wales).As there seems to be a desire that the practice shall be uniform, as far as possible, so as to avoid conducting the election in part by ballot and in part by open voting, I beg to move - That the words ""House of Commons practice be adopted"" be omitted, with the view to the insertion in lieu thereof of the words ""the election be by ordinary ballot. "" The first paragraph of the motion will then read - That if no more than two candidates are proposed the election be b3' ordinary ballot. The effect of that would he that if only two candidates were proposed an ordinary ballot would be taken. If there were three candidates the motion moved by the honorable member for an exhaustive ballot would stand. Then the whole procedure would be as uniform as possible instead of having part by open voting and part by ballot.",0,0,0,0,,,0,1
Senator O'Connor,15,8.0,10.0,,JYD,,,0,0,That is not part of the motion. I merely make that suggestion.,0,0,0,0,,,1,1
Senator HIGGS,16,8.0,10.0,,KHE,,,0,0,I thought it necessary to make these remarks because honorable members seemed to deprecate having any discussion whatever.,0,0,0,0,,,0,1
Senator EWING,17,9.0,11.0,,JYQ,Western Australia,,0,0,"I have very much pleasure in seconding the amendment. I do not think the Senate can be divided in the opinion that whatever method we adopt should be a uniform one. If it is wise to adopt the system of ballot under certain circumstances, surely it is wise even if there are only two candidates. With regard to what Senator Higgs has said, I think the proposal of the Vice President of the Executive Council was only meant as a suggestion. Personally I do not agree with it. We come from another State, and we are not closely in touch with the public men in the community in which we are now living. We desire to know the qualifications of the gentlemen for whom we are asked to vote. It is all very well for those who live in Melbourne or Sydney to say they know the merits of the various gentlemen who are to be proposed for this office, but realizing as we do that the office of President is a most important one, we, as Senators coming from far-off portions of the continent, desire to hear what can be said either for or against the . individual candidates. Senator O'CONNOR
                    (New South Wales Vice President of the Executive Council). - It seems to me a matter of very small moment, but at the same time I am quite willing to accept the amendment of
                    Senator Neild.
                    I would suggest to the honorable member that the amendment does not really carry out his wishes. What he proposes is that, under all circumstances, this election shall be by ballot. I think that might be carried out by a very simple alteration at the beginning of the motion. I do not want to enter into any verbal discussion; but the honorable member will see, if lie reads his amendment, that it leaves a portion of the motion which is inconsistent with it. If the honorable member desires it, I will add a few words to the motion to make it fit in with his view. We are dealing with matters of substance now; and I think it is the general wish of the House that this should be simply a motion to proceed by ballot under all circumstances. That the election be by ballot. If, on the first ballot, any candidate has an absolute majority of the votes given, he shall be declared elected President ; if on such first ballot no candidate have such absolute majority, all candidates, except the two highest on the first ballot, drop out, and a second ballot shall then be taken between the two candidates so left, and the candidate obtaining the majority on the second ballot shall be declared elected President.",0,0,0,0,,,0,1
Senator DAWSON,18,9.0,11.0,,JTV,,ALP,0,0,No Senator is ashamed] of his vote.,0,0,0,0,,,1,1
Senator Neild,19,9.0,11.0,,JXT,,,0,0,But will the amended motion provide for an exhaustive ballot ?,0,0,0,0,,,1,1
Senator O'CONNOR,20,9.0,11.0,,JYD,,,0,0,"Yes. By leave I beg to withdraw my motion, and to substitute another, which embodies Senator Neild's amendment, and really expresses the sense of the Senate. .It is as follows -",0,0,0,0,,,1,1
Senator NEILD,21,10.0,11.0,,JXT,,,0,0,"With the consent of Senator Ewing, who seconded my amendment, I am very happy to withdraw it, if the Chamber is willing. Amendment withdrawn. Substituted motion, proposed, put.",0,0,0,0,,,0,1
Senator DAWSON,22,11.0,11.0,,JTV,QUEENSLAND,ALP,0,0,"I wish to express my opinion that the amended motion is not a satisfactory one to the public whom we are supposed to represent in this Chamber. It is not satisfactory for the simple reason that it still provides for a secret ballot. If there is one thing above another that we have to do in this Chamber it is to let the public outside know exactly on which side and in which direction we cast our votes. I for one am against any attempt at secret voting in the Senate, and I am, therefore, distinctly against the amended motion. If honorable members who have been honoured by the people of Australia by being selected to represent them in the Senate are ashamed to cast their votes openly let them say so, and let the public know it. I am not. I am quite willing to vote openly. If there is one place in the whole of Australia where this course should be adopted it is in the legislative halls of the Commonwealth, and particularly in the Senate. I desire to direct the attention of honorable members, through you, Mr. Blackmore, to' a most irregular proceeding of this afternoon, and I am very much astonished that the representative of Queensland, who is sitting on the Ministerial bench, has not thought fit to interfere in the matter. I refer to the fact that very important motions are being moved, and that copies of them have not been handed to honorable members. We know no more of them than the general public. A surprise motion has been sprung upon us. Several Senators. - Nonsense ! That till the words after ""That"" be omitted, with a view to the insertion in lieu thereof of the words "" the election be by open voting.!'",0,0,0,0,,,0,1
Senator Cameron,23,11.0,12.0,,K3S,,,0,0,We are here for the first time.,0,0,0,0,,,1,1
Senator DAWSON,24,11.0,12.0,,JTV,,ALP,0,0,That is true ; but the honorable gentleman who has moved this motion has taken the precaution to have a ballot-paper printed and circulated.,0,0,0,0,,,0,1
Senator O'Connor,25,11.0,12.0,,JYD,,,0,0,It is only an alphabetical list of names.,0,0,0,0,,,1,1
Senator DAWSON,26,11.0,12.0,,JTV,,ALP,0,0,"It is perfectly clear to my mind that the Government had determined beforehand what it was going to do in regard to this matter, and that it would bring along this particular motion.",0,0,0,0,,,0,1
Senator Millen,27,11.0,12.0,,KUL,,,0,0,"It does not look like it, or more care would have been taken with this paper.",0,0,0,0,,,1,1
Senator DAWSON,28,11.0,12.0,,JTV,,ALP,0,0,"I have never known it to be done in Queensland, and I hope a similar state of things will not occur again. It is idle for honorable members to say "" Nonsense."" How many have received a copy of the motion 1",0,0,0,0,,,0,1
Senator Charleston,29,11.0,12.0,,K6J,,,0,0,We do not require it. You have already decided for whom your vote will be cast.,0,0,0,0,,,1,1
Senator DAWSON,30,11.0,12.0,,JTV,,ALP,0,0,Yes; I have already decided for whom I shall vote.,0,0,0,0,,,0,1
Senator Charleston,31,11.0,12.0,,K6J,,,0,0,And yet }'ou ask for information as to the abilities of the candidates.,0,0,0,0,,,1,1
Senator DAWSON,32,11.0,12.0,,JTV,,ALP,0,0,"The question is not for whom I shall vote, but how I shall vote, and I absolutely object to any secret voting in the Senate. Let every honorable member vote openly, and stand by his vote. I therefore move by way of amendment -",0,0,0,0,,,0,1
Senator STEWART,33,12.0,12.0,,K7D,Queensland,,0,0,"In seconding the amendment I desire to say that the proposition appears to me to be an extraordinary one. The honorable gentleman who brought forward the motion seems to forget altogether that we are here in our representative capacity to appoint the first President of the Senate of the Commonwealth Parliament, and that our constituents are just as much interested in how we vote upon this question as they are in how we vote on any other subject. For that reason, I decidedly object to any attempt to throw the veil of secrecy over the proceedings of the Senate. The motion appears to me to be entirely opposed to the traditions of Parliament. Why should there be secret voting? Do honorable members object to the public knowing for whom they vote? I think it is the right of the people who sent us here to have that information given to them. ' There is no need for me to prolong this discussion. My mind is made up ; and I am decidedly opposed to anything in the way of secrecy. Senator GOULD
                    (New South Wales).I am perfectly certain that honorable members do not desire to hide from the public the way in which they record their votes in this election or on any other occasion. I certainly understood when
                    Senator O'Connor
                    tabled his motion originally that it was done really with the object of getting over a difficulty that might arise by means of open voting if there were more than two candidates proposed. Any one who knows how these things operate in deliberative assemblies must be aware that where three or more candidates are proposed it frequently happens that the man elected is not really the
                    bona fide
                    choice of the majority. If there are three candidates one man's name is put first of all before the House, and the honorable members who are going to support the other two generally vote against him. By that means a man who is only acceptable to the minority, possibly, succeeds. Therefore, I think there is very good reason for supporting
                    Senator O'Connor's
                    proposition. I understand that certain sections of honorable members have held secret caucuses, and determined whom they shall support. While they come before the public and give a public vote we do not know what their own honest convictions are, because there have been debates and votes behind the back of Parliament. I am very glad to hear, however, that some honorable members feel now that it is desirable the public should know the direction in which their votes are cast. I want the public also to know that they are being cast on the independent judgment of honorable members, and not at the dictation of a majority of any particular section.",0,0,0,0,,,0,1
Senator Higgs,34,12.0,12.0,,KHE,,,0,0,What section ?,0,0,0,0,,,1,1
Senator GOULD,35,13.0,12.0,,KLZ,NEW SOUTH WALES,,0,0,I am told there is a section which determined either yesterday or this morning to support a certain honorable member.,0,0,0,0,,,0,1
Senator DAWSON,36,13.0,13.0,,JTV,,ALP,0,0,To what section do you belong ?,0,0,0,0,,,1,1
Senator GOULD,37,13.0,13.0,,KLZ,,,0,0,"I belong to the independent section. I do not belong to any particular caucus. I think we shall find it best to adopt Senator O'Connor's proposition, and I hope whatever caucuses there may be honorable members will remember that their first duty is to the public, that they should let the public know what their honest convictions are, and. that they should not vote according to the - dictates of the majority of the particular section to which they belong.",0,0,0,0,,,0,1
Senator MATHESON,38,14.0,13.0,,KSQ,Western Australia,,0,0,"I think honorable members have to a great extent overlooked the fact that to-day we have to form a precedent in regard to the election of President of the Senate. We know that in the House of Commons the invariable practice has been to elect the Speaker on the voices by open voting, and, as far as I am aware, the practice in the Australian States has always been in the same direction. Is it desirable that we, meeting here to-day as a new elective body, should without very grave consideration start a new system in regard "" to the election of our President which will be a precedent for all time 1 That is not ""the way in which we should enter upon the business of the session. When Senator O'Connor first addressed us on this subject, he distinctly pointed out that his only motive for advocating election by ballot was to eliminate any candidates above the number of two, and that he had originally intended, in case there were only two, that the election should be by open voting. I was perfectly prepared to go with him as far as the adoption of the ballot for eliminating the extra number was concerned ; but, since he has now adopted the amendment suggested by Senator Neild, I am perforce compelled to support the amendment moved by Senator Dawson, who strongly advocated election by open voting. To my mind it is really a most serious matter that we should attempt to establish to-day a precedent entirely different from the precedents which have been in vogue for countless years, both in Great Britain and in these States. If it had been possible to move as a further amendment that the method adopted by the House of Commons should be followed, so that we might have the advantage of al1, the experience which, has been brought to bear on the subject in that Chamber, I should have been prepared to support it. As this cannot be done, I shall strongly support the amendment.",0,0,0,0,,,0,1
Senator CHARLESTON,39,15.0,13.0,,K6J,South Australia,,0,0,"I shall strongly support voting by ballot. What I had hoped was that we should have met- the whole of us - to quietly select our President, and that we should then have adopted the method adopted, I believe, in the British Parliament of some one moving that Mr. So-and-So should be President, when he would have been conducted to the chair. That is what I and a great many honorable members had hoped would have been done. We should then have avoided waste of time and have avoided also the warmth which has been introduced this afternoon. We, in voting by ballot, will record our votes in the direction which we think best in the interests of the country. We are not afraid to express our opinions. I think it is well known how the vote will go. It is better, in the interests of the candidates themselves and in the interests of the Senate, that we should adopt this method, seeing that we have entered the chamber with the supposition that there will be three candidates. If we had adopted the other method of quietly arranging it, then of course it could have been done as it is done in the British House of Commons, and there .would have been no loss of time. I shall support the motion that the election be by ballot, and I am quite sure that those who sent us here will be satisfied that we are acting in the interests of the Commonwealth, and are not, as some of our friends seem to think, seeking to adopt some clandestine way of doing our work.",0,0,0,0,,,0,1
